API,Article,Date,Searchword,Summary,Title,URL,Verified,Language,Source,Title_Sentiment,Title_Positive,Title_Neutral,Title_Negative,Article_Sentiment,Article_Positive,Article_Neutral,Article_Negative,NER,Topics
NewsApi.org,"HONG KONG (Reuters) - Some China Evergrande Group bondholders have received coupon payments for a dollar bond tranche that was due Sept. 23 and for which the 30-day grace period ended last Saturday, two people with knowledge of the matter said on Monday.

Evergrande, the world's most indebted property firm with more than $300 billion in liabilities, had sent $83.5 million to a Citibank trustee account on Thursday, a person with knowledge of the matter told Reuters on Friday.

That fund has now been transferred to at least some of the offshore bondholders, said the people on Monday, declining to be identified as they were not authorised to speak to the media.

An Evergrande spokesperson said the company did not have a comment.

(Reporting by Clare Jim and Andrew Galbraith; Editing by Christopher Cushing)",25/10/2021,Citibank,"HONG KONG (Reuters) - Some China Evergrande Group bondholders have received coupon payments for a dollar bond tranche that was due Sept. 23 and for which the 30-day grace period ended last Saturday, two people with knowledge of the matter said on Monday.
Evergrande, the world's most indebted property firm with more than $300 billion in liabilities, had sent $83.5 million to a Citibank trustee account on Thursday, a person with knowledge of the matter told Reuters on Friday.
That fund has now been transferred to at least some of the offshore bondholders, said the people on Monday, declining to be identified as they were not authorised to speak to the media.
An Evergrande spokesperson said the company did not have a comment.
(Reporting by Clare Jim and Andrew Galbraith; Editing by Christopher Cushing)",Some Evergrande bondholders received coupon payment for Sept 23 tranche -sources,https://finance.yahoo.com/news/evergrande-bondholders-received-coupon-payment-033037457.html,TRUE,English,finance.yahoo.com,negative,0.01,0.15,0.84,mixed,0.33,0.33,0.34,"['Evergrande', 'Reuters', 'China Evergrande Group', 'Evergrande', 'Citibank', 'Reuters', 'Evergrande']","['Some Evergrande bondholders', 'coupon payment', 'Sept 23 tranche', 'sources', 'Some China Evergrande Group bondholders', 'dollar bond tranche', '30-day grace period', 'indebted property firm', 'Citibank trustee account', 'An Evergrande spokesperson', 'offshore bondholders', 'HONG KONG', 'coupon payments', 'Clare Jim', 'Andrew Galbraith', 'Christopher Cushing', 'two people', 'Reuters', 'knowledge', 'matter', 'Monday', 'world', 'liabilities', 'Thursday', 'Friday', 'fund', 'media', 'company', 'comment', 'Editing']"
NewsApi.org,"Show caption The Reserve Bank of New Zealand has increased interest rates for the first time in seven years. Photograph: David Gray/Reuters New Zealand New Zealand raises interest rates for the first time in seven years Rate hike puts New Zealand ahead of most other developed economy nations as central banks look to wind back emergency-level borrowing costs Reuters Wed 6 Oct 2021 05.41 BST Share on Facebook

Share on Twitter

Share via Email

New Zealand’s central bank has raised interest rates for the first time in seven years, signalling further tightening to come, as it looks to get on top of inflationary pressures and cool a red-hot housing market.

The 25 basis point rate rise on Wednesday marks the start of a tightening cycle that had been expected to begin in August, but was delayed after an outbreak of the coronavirus Delta variant and a lockdown that is continuing in its biggest city Auckland.

The New Zealand dollar briefly rose after the announcement of the increase in the official cash rate to 0.50%, but fell back to $0.6930, in line with broader market moves.

“It was pretty much in line with what everyone was picking,” Jason Wong, senior market strategist at BNZ in Wellington, said. “We’re on a path towards a series of rate hikes and the market is well priced for that.“

Announcing its decision, the RBNZ said further removal of monetary policy stimulus was expected, with future moves depending on the medium-term outlook for inflation and employment.

The rate hike puts New Zealand ahead of most other developed economy nations as central banks look to wind back emergency-level borrowing costs, although countries including Norway, the Czech Republic and South Korea have already raised rates.

In Australia, the central bank held interest rates at a record low 0.1% for an 11th straight month on Tuesday.

Economists expect the benchmark rate to reach 1.50% by the end of next year and 1.75% by the end of 2023, a Reuters poll showed.

New Zealand has enjoyed a rapid economic recovery since a Covid-driven recession last year, partly because it reopened its economy before others following efforts to eliminate coronavirus.

But with its borders still shut, labour and goods shortages are pushing up inflation, as well as contributing to a surging property market, which has been driven by ultra-low interest rates.

“Demand shortfalls are less of an issue than the economy hitting capacity constraints,” the RBNZ committee noted in the minutes of the meeting.

The central bank said headline CPI inflation is expected to increase above 4% in the near-term but return towards its 2% midpoint over the medium term.

Recent Covid-19 restrictions have not materially changed the medium-term outlook for inflation and employment, and economic activity will recover quickly when the measures are eased, it said.

But economists said the RBNZ may not race ahead with its hiking cycle in view of the current global uncertainty and the Delta variant outbreak dragging on in Auckland.

“[We] remain of the view that further rate hikes will be in 25 basis point increments rather than 50 basis point moves,” Citibank economist Josh Williamson said.

New Zealand abandoned its strategy of eliminating Covid-19 this week, with the government saying it will have to live with the virus and step up vaccination rates to control it.

In August, a central bank official confirmed it had also considered a 50-basis-point move that month, before taking a rate hike off the table altogether due to the lockdown.",06/10/2021,Citibank,"Show caption The Reserve Bank of New Zealand has increased interest rates for the first time in seven years.
Photograph: David Gray/Reuters New Zealand New Zealand raises interest rates for the first time in seven years Rate hike puts New Zealand ahead of most other developed economy nations as central banks look to wind back emergency-level borrowing costs Reuters Wed 6 Oct 2021 05.41 BST Share on FacebookShare on TwitterShare via EmailNew Zealand’s central bank has raised interest rates for the first time in seven years, signalling further tightening to come, as it looks to get on top of inflationary pressures and cool a red-hot housing market.
In Australia, the central bank held interest rates at a record low 0.1% for an 11th straight month on Tuesday.
But with its borders still shut, labour and goods shortages are pushing up inflation, as well as contributing to a surging property market, which has been driven by ultra-low interest rates.
The central bank said headline CPI inflation is expected to increase above 4% in the near-term but return towards its 2% midpoint over the medium term.",New Zealand raises interest rates for the first time in seven years,https://amp.theguardian.com/world/2021/oct/06/new-zealand-raises-interest-rates-for-the-first-time-in-seven-years,TRUE,English,amp.theguardian.com,positive,0.54,0.45,0.01,mixed,0.16,0.16,0.68,"['Reserve Bank of New Zealand', 'Reuters', 'Reuters', 'Facebook', 'Twitter', 'central bank', 'BNZ', 'RBNZ', 'Reuters', 'RBNZ', 'central bank', 'RBNZ', 'Citibank']","['New Zealand', 'interest rates', 'first time', 'seven years', 'most other developed economy nations', 'Citibank economist Josh Williamson', 'Reuters New Zealand New Zealand', 'The New Zealand dollar', '25 basis point rate rise', '25 basis point increments', '50 basis point moves', 'emergency-level borrowing costs', 'monetary policy stimulus', '11th straight month', 'Recent Covid-19 restrictions', 'current global uncertainty', 'The Reserve Bank', 'red-hot housing market', 'senior market strategist', 'surging property market', 'rapid economic recovery', 'official cash rate', 'broader market moves', 'coronavirus Delta variant', 'biggest city Auckland', 'Delta variant outbreak', 'central bank official', 'headline CPI inflation', 'ultra-low interest rates', 'future moves', 'Reuters poll', 'economic activity', 'Rate hike', 'benchmark rate', 'central banks', 'Show caption', 'first time', 'seven years', 'David Gray', 'BST Share', 'Facebook\n\nShare', 'Twitter\n\nShare', 'inflationary pressures', 'tightening cycle', 'Jason Wong', 'medium-term outlook', 'Czech Republic', 'South Korea', 'record low', 'next year', 'Covid-driven recession', 'goods shortages', 'Demand shortfalls', 'capacity constraints', 'medium term', 'hiking cycle', 'vaccination rates', '50-basis-point move', 'RBNZ committee', 'Photograph', 'Email', 'top', 'Wednesday', 'start', 'August', 'lockdown', 'announcement', 'increase', 'everyone', 'Wellington', 'path', 'series', 'decision', 'removal', 'employment', 'countries', 'Norway', 'Australia', 'Tuesday', 'Economists', 'end', 'others', 'efforts', 'borders', 'labour', 'issue', 'minutes', 'meeting', 'near-term', '2% midpoint', 'measures', 'view', 'strategy', 'government', 'table']"
NewsApi.org,"China Evergrande Group (3333.HK) wired funds to a trustee account on Thursday for a dollar bond interest payment due Sept. 23, a source told Reuters on Friday, days before a deadline that would have plunged the embattled developer into formal default.

The source corroborated a story in the state-backed Securities Times on Friday that the company had remitted $83.5 million in coupon payments to a trustee account at Citibank on Thursday, allowing it to pay out to all bond holders before the grace period expires on Oct. 23.

""They seem to be avoiding short-term default and it's a bit of a relief that they have managed to find liquidity,"" said a Hong Kong-based restructuring lawyer representing some bondholders.

WHAT LIES BENEATH? HIDDEN DEBT FEARS FEED CHINA'S PROPERTY WOES

""But still, Evergrande does need to restructure its debt. This payment might be a way for them to get some sort of buy-in with stakeholders before the heavy work needed on the restructuring.""

Evergrande did not immediately respond to Reuters request for comment. Citi declined to comment.

News of the wired payment comes a day after financial information provider REDD reported on Thursday that the company had secured more time to pay a defaulted bond issued by Jumbo Fortune Enterprises and guaranteed by Evergrande. read more

A string of Chinese officials in recent days have sought to reassure investors, saying that creditors' interests would be protected. Market participants nevertheless expressed shock at news of the payment. read more

""This is a positive surprise,"" said James Wong, portfolio manager at GaoTeng Global Asset Management Ltd, adding many had expected a default.

CHINA POWER ISSUE MAY MAKE THE GLOBAL CAR SHORTAGE MUCH WORSE

The news would boost bondholders' confidence, he said, as ""there are many coupon payments due ahead. If Evergrande pays this time, I don't see why it won't pay the next time.""

Evergrande missed two coupon payments on its dollar bonds on Sept. 23 and Sept. 30, starting the clock on 30-day grace periods for payment. Non-payment of interest for 30 days would result in a formal default by the company, and trigger cross-default provisions for other Evergrande dollar bonds.

Evergrande's dollar bonds surged on Friday morning, with its April 2022 and 2023 notes jumping more than 10%, according to data provider Duration Finance.

Evergrande's shares rose about 4%, a day after the resumption of trade following a more than two-week suspension pending the announcement of a scrapped stake sale in its property management unit.

GET FOX BUSINESS ON THE GO BY CLICKING HERE

The Hang Seng mainland properties index (.HSMPI) surged more than 5% in early trade, against a 0.13% rise in the broader Hang Seng index. (.HSI)",22/10/2021,Citibank,"China Evergrande Group (3333.HK) wired funds to a trustee account on Thursday for a dollar bond interest payment due Sept. 23, a source told Reuters on Friday, days before a deadline that would have plunged the embattled developer into formal default.
HIDDEN DEBT FEARS FEED CHINA'S PROPERTY WOES""But still, Evergrande does need to restructure its debt.
CHINA POWER ISSUE MAY MAKE THE GLOBAL CAR SHORTAGE MUCH WORSEThe news would boost bondholders' confidence, he said, as ""there are many coupon payments due ahead.
Evergrande missed two coupon payments on its dollar bonds on Sept. 23 and Sept. 30, starting the clock on 30-day grace periods for payment.
Non-payment of interest for 30 days would result in a formal default by the company, and trigger cross-default provisions for other Evergrande dollar bonds.","China Evergrande wires funds for bond coupon, averting default - Fox Business",https://www.foxbusiness.com/markets/china-evergrande-wires-funds-bond-coupon-averting-default,TRUE,English,foxbusiness.com,neutral,0,1,0,mixed,0.25,0.06,0.69,"['China Evergrande', 'Fox Business', 'China Evergrande Group', 'Reuters', 'Securities Times', 'Citibank', 'Evergrande', 'Evergrande', 'Reuters', 'REDD', 'Jumbo Fortune Enterprises', 'Evergrande', 'GaoTeng Global Asset Management Ltd', 'Evergrande', 'Evergrande', 'Evergrande', 'Duration Finance', 'Evergrande', 'FOX', 'HSMPI', 'Hang Seng', 'HSI']","['China Evergrande', 'bond coupon', 'Fox Business', 'funds', 'default', 'The Hang Seng mainland properties index', 'GLOBAL CAR SHORTAGE MUCH WORSE', 'GaoTeng Global Asset Management Ltd', 'broader Hang Seng index', 'Hong Kong-based restructuring lawyer', 'other Evergrande dollar bonds', 'dollar bond interest payment', 'property management unit', 'state-backed Securities Times', 'Jumbo Fortune Enterprises', 'financial information provider', '30-day grace periods', 'CHINA POWER ISSUE', 'many coupon payments', 'two coupon payments', 'China Evergrande Group', 'PROPERTY WOES', 'data provider', 'bond holders', 'trustee account', 'FEARS FEED', 'heavy work', 'Chinese officials', ""creditors' interests"", 'Market participants', 'positive surprise', 'James Wong', 'portfolio manager', 'cross-default provisions', 'Duration Finance', 'two-week suspension', 'stake sale', 'FOX BUSINESS', 'wired payment', 'formal default', 'short-term default', 'HIDDEN DEBT', 'Reuters request', 'recent days', ""bondholders' confidence"", 'early trade', 'Friday morning', '30 days', 'funds', 'Thursday', 'Sept', 'source', 'deadline', 'developer', 'story', 'company', 'Citibank', 'Oct.', 'bit', 'relief', 'liquidity', 'BENEATH', 'way', 'sort', 'stakeholders', 'comment', 'News', 'REDD', 'string', 'investors', 'shock', 'clock', 'Non-payment', 'April', 'shares', 'resumption', 'announcement', 'GO', 'HSMPI', '0.13% rise', 'HSI']"
NewsApi.org,"St George / Bank of Melbourne has extended the $3,000 cashback offer

$3,000 bank cashback (>$250k)

85%LVR $1 LMI for first home borrowers (<$850k)

Owner occ 60LVR (+0.05% for 80LVR)

2 year fixed 1.79% CPR 3.33%

3 year fixed 1.98% CPR 3.35%

Variable from 2.44% to 2.59% CPR 2.80 - 2.95% offset

Variable from 2.24% CPR 2.26% basic no annual fee

Investor 60LVR (+0.05% for 80LVR)

2 year fixed 2.19% CPR 3.84%

Variable from 2.69% CPR 2.73% offset

Variable 2.59% CPR 2.61% basic no annual fee

Other lenders up to $6000 cashback other lenders

$3,000 ING - per application (>$500k loan size but can owe less) - variable no fee from 2.24%, fixed 2yr 1.89%.

$3,000 St George/Bank of Melbourne, fixed 2yr 1.79%, 85%LVR no LMI. $395 package offset annual fee

$3,000 Westpac, variable from 1.99% no annual fee

$3,000 - $6,000 (up to) PURCHASE OR REFI Citibank, fixed 2yr 1.89%, 3yr 1.99%

PLUS up to 0.4% ie $4000 broker rebate per loan (on top of bank cashback, available via broker only, not via the bank)

In ADDITION to bank rebates, we have 0.3% - 0.4% broker rebate (based on net of offset/redraw ie balance owing) for ANY bank or product. (Loans >$250k paid as eGift cards from any retailer of your choice 50/50 at 2 and 24 months after settlement).

For example:

$300k x 0.3% = $900 Broker rebate

$500k x 0.3% = $1,500 Broker rebate

$1m x 0.4% = $4,000 Broker rebate

Contact Us for this offer

Please email [email protected] at first instance and we will reply ASAP.

Missed calls and OzB messages may get delayed.

If you don't get email reply within 24-48hrs (some emails go into our spam), pls call us or text us.

Len

Bundle Property Home Loans

Please email [email protected] at first instance and we will reply ASAP.

T: (02) 9698 7186

M: 0422354868

ACL 445947",14/10/2021,Citibank,"$3,000 St George/Bank of Melbourne, fixed 2yr 1.79%, 85%LVR no LMI.
(Loans >$250k paid as eGift cards from any retailer of your choice 50/50 at 2 and 24 months after settlement).
For example:$300k x 0.3% = $900 Broker rebate$500k x 0.3% = $1,500 Broker rebate$1m x 0.4% = $4,000 Broker rebateContact Us for this offerPlease email [email protected] at first instance and we will reply ASAP.
If you don't get email reply within 24-48hrs (some emails go into our spam), pls call us or text us.
LenBundle Property Home LoansPlease email [email protected] at first instance and we will reply ASAP.","St George/Bank of Melbourne Home Loan: from 1.79% 2 Yrs Fixed, 2.24% Variable No Annual Fee & $3000 Bank Cashback",https://www.ozbargain.com.au/node/657134,TRUE,English,ozbargain.com.au,neutral,0.07,0.9,0.03,mixed,0.21,0.17,0.62,"['St George', 'Bank of Melbourne', 'St George', 'Bank of Melbourne', 'St George', 'Bank of Melbourne', 'Westpac', 'Citibank', 'OzB']","['Melbourne Home Loan', 'No Annual Fee', 'Bank Cashback', '2 Yrs', 'Len\n\nBundle Property Home Loans', 'first home borrowers', 'Owner occ 60LVR', 'offset/redraw ie balance', '$500k loan size', 'annual fee\n\nInvestor', 'first instance', 'St George', 'Other lenders', 'REFI Citibank', 'eGift cards', 'Contact Us', 'OzB messages', 'email reply', '$4000 broker rebate', '0.4% broker rebate', '$3,000 cashback offer', '$3,000 bank cashback', 'bank rebates', 'Melbourne', '80LVR', '9% CPR', 'Variable', '2.24% CPR', 'year', 'application', 'LMI', '$395 package', 'Westpac', 'PURCHASE', 'top', 'ADDITION', 'net', 'product', 'retailer', 'choice', 'settlement', 'example', 'calls', '24-48hrs', 'emails', 'spam', 'pls', 'ACL']"
NewsApi.org,"LONDON--(BUSINESS WIRE)--Citi, acting through Citibank N.A., has been appointed by Exscientia plc (“Exscientia”), an AI-driven pharmatech company committed to designing and developing the best possible drugs in the fastest and most effective manner, to act as depositary bank for its American Depositary Receipt (“ADR”) programme.

Exscientia’s American Depositary Shares (“ADS”) trade on the Nasdaq Global Market under the symbol “EXAI”. Each ADS represents one ordinary share of the company.

Commenting on the appointment, Dirk Jones, Global Head of Issuer Services, at Citi said: “We look forward to supporting Exscientia’s ADR programme and expanding the company’s investor outreach through the expertise of our Investor Relations Advisory team and the breadth of our global equity distribution network.”

For more information on Citi’s Depositary Receipt Services, please visit www.citi.com/dr

About Exscientia

Exscientia is an AI-driven pharmatech company committed to discovering, designing and developing the best possible drugs in the fastest and most effective manner. Exscientia developed the first-ever functional precision oncology platform to successfully guide treatment selection and improve patient outcomes in a prospective interventional clinical study, as well as to progress AI-designed small molecules into the clinical setting. Our pipeline demonstrates our ability to rapidly translate scientific concepts into precision-designed therapeutic candidates, with more than 25 projects advancing, including the first three AI-designed drug candidates to enter Phase 1 clinical trials. Exscientia has offices in Oxford, Miami, Vienna, Osaka and Dundee.

About Citi

Citi, the leading global bank, has approximately 200 million customer accounts and does business in more than 160 countries and jurisdictions. Citi provides consumers, corporations, governments and institutions with a broad range of financial products and services, including consumer banking and credit, corporate and investment banking, securities brokerage, transaction services, and wealth management.

Additional information may be found at www.citigroup.com | Twitter: @Citi | YouTube: www.youtube.com/citi | Blog: http://blog.citigroup.com | Facebook: www.facebook.com/citi | LinkedIn: www.linkedin.com/company/citi",06/10/2021,Citibank,"LONDON--(BUSINESS WIRE)--Citi, acting through Citibank N.A., has been appointed by Exscientia plc (“Exscientia”), an AI-driven pharmatech company committed to designing and developing the best possible drugs in the fastest and most effective manner, to act as depositary bank for its American Depositary Receipt (“ADR”) programme.
Exscientia’s American Depositary Shares (“ADS”) trade on the Nasdaq Global Market under the symbol “EXAI”.
Exscientia has offices in Oxford, Miami, Vienna, Osaka and Dundee.
About CitiCiti, the leading global bank, has approximately 200 million customer accounts and does business in more than 160 countries and jurisdictions.
Additional information may be found at www.citigroup.com | Twitter: @Citi | YouTube: www.youtube.com/citi | Blog: http://blog.citigroup.com | Facebook: www.facebook.com/citi | LinkedIn: www.linkedin.com/company/citi",Citi Appointed as Depositary Bank for Exscientia plc’s ADR Programme,https://www.businesswire.com/news/home/20211006005061/en/Citi-Appointed-as-Depositary-Bank-for-Exscientia-plc%E2%80%99s-ADR-Programme,TRUE,English,businesswire.com,neutral,0.04,0.95,0.01,mixed,0.4,0.3,0.3,"['Citi', 'Exscientia plc', 'BUSINESS WIRE', 'Citibank N.A.', 'Exscientia plc', 'Exscientia', 'Exscientia', 'American Depositary Shares', 'ADS', 'Nasdaq Global Market', 'Citi', 'Exscientia', 'Citi', 'Depositary Receipt Services', 'Exscientia', 'Exscientia', 'Exscientia', 'Exscientia', 'Citi', 'Citi', 'Citi', 'Twitter', 'YouTube', 'Facebook', 'LinkedIn']","['Depositary Bank', 'Exscientia plc', 'ADR Programme', 'Citi', 'first-ever functional precision oncology platform', 'first three AI-designed drug candidates', 'Investor Relations Advisory team', 'global equity distribution network', 'prospective interventional clinical study', 'precision-designed therapeutic candidates', 'Citibank N.A.', 'best possible drugs', 'Nasdaq Global Market', 'one ordinary share', 'Phase 1 clinical trials', '200 million customer accounts', 'American Depositary Receipt', 'American Depositary Shares', 'leading global bank', 'AI-driven pharmatech company', 'Depositary Receipt Services', 'depositary bank', 'Global Head', 'investor outreach', 'clinical setting', 'effective manner', 'Dirk Jones', 'Issuer Services', 'treatment selection', 'patient outcomes', 'small molecules', 'scientific concepts', 'broad range', 'financial products', 'consumer banking', 'investment banking', 'securities brokerage', 'transaction services', 'wealth management', 'BUSINESS WIRE', 'Additional information', 'Exscientia plc', 'ADR programme', 'LONDON', 'fastest', 'ADS', 'symbol', 'EXAI', 'appointment', 'expertise', 'breadth', 'pipeline', 'ability', '25 projects', 'offices', 'Oxford', 'Miami', 'Vienna', 'Osaka', 'Dundee', '160 countries', 'jurisdictions', 'consumers', 'corporations', 'governments', 'institutions', 'credit', 'corporate', 'citigroup', 'Twitter', 'YouTube', 'Blog', 'Facebook', 'LinkedIn']"
