API,Article,Date,Searchword,Summary,Title,URL,Verified,Language,Source,Title_Sentiment,Title_Positive,Title_Neutral,Title_Negative,Article_Sentiment,Article_Positive,Article_Neutral,Article_Negative,NER,Topics
NewsApi.org,"People walk beneath a Citibank branch logo in the financial district of San Francisco, California July 17, 2009. REUTERS/Robert Galbraith

HONG KONG, Oct 5 (Reuters) - Citigroup (C.N) has appointed William Pang as the head of its Natural Resources and Clean Energy Transition (NRCET) Investment Banking unit in Asia, according to a statement from the bank.

Pang joined Citi in 2015 and will continue to lead infrastructure investment banking in Asia, the statement said.

NRCET was established globally in March this year to work with the bank's clients on transitioning to cleaner energy.

Three of Citi's banking groups - chemicals, energy and power - were consolidated into one as part of a push to grow the bank's environmental sustainability coverage.

Pang will report to Jan Metzger, Citi Asia Pacific head of Banking, Capital Markets and Advisory, and globally to NRCET co-heads Stephen Trauber and Sandip Sen.

""Clean energy transition is a global super trend that is accelerating rapidly and will last decades,"" Metzger said in the statement.

Reporting by Scott Murdoch in Hong Kong; Editing by Krishna Chandra Eluri

Our Standards: The Thomson Reuters Trust Principles.",05/10/2021,Citibank,"REUTERS/Robert GalbraithHONG KONG, Oct 5 (Reuters) - Citigroup (C.N) has appointed William Pang as the head of its Natural Resources and Clean Energy Transition (NRCET) Investment Banking unit in Asia, according to a statement from the bank.
Pang joined Citi in 2015 and will continue to lead infrastructure investment banking in Asia, the statement said.
NRCET was established globally in March this year to work with the bank's clients on transitioning to cleaner energy.
Three of Citi's banking groups - chemicals, energy and power - were consolidated into one as part of a push to grow the bank's environmental sustainability coverage.
Pang will report to Jan Metzger, Citi Asia Pacific head of Banking, Capital Markets and Advisory, and globally to NRCET co-heads Stephen Trauber and Sandip Sen.""Clean energy transition is a global super trend that is accelerating rapidly and will last decades,"" Metzger said in the statement.",MOVES Citi appoints Pang to head clean energy banking in Asia - Reuters,https://www.reuters.com/business/moves-citi-appoints-pang-head-clean-energy-banking-asia-2021-10-05/,TRUE,English,reuters.com,positive,0.89,0.11,0,positive,0.82,0.16,0.02,"['Citi', 'Reuters', 'Citibank', 'REUTERS', 'Reuters', 'Citigroup', 'C.N', 'its', 'Natural Resources and Clean Energy Transition', 'NRCET', 'Citi', 'NRCET', 'Citi', 'Citi Asia Pacific', 'NRCET', 'Thomson Reuters']","['clean energy banking', 'MOVES Citi', 'Pang', 'Asia', 'Reuters', 'The Thomson Reuters Trust Principles', 'NRCET) Investment Banking unit', 'Citi Asia Pacific head', 'Citibank branch logo', 'infrastructure investment banking', 'environmental sustainability coverage', 'global super trend', 'Krishna Chandra Eluri', 'Clean Energy Transition', 'banking groups', 'cleaner energy', 'financial district', 'San Francisco', 'Robert Galbraith', 'HONG KONG', 'C.N', 'Natural Resources', 'Capital Markets', 'Stephen Trauber', 'Sandip Sen', 'Scott Murdoch', 'Jan Metzger', 'William Pang', 'People', 'California', 'Citigroup', 'statement', 'March', 'clients', 'chemicals', 'power', 'part', 'push', 'Advisory', 'heads', 'Reporting', 'Editing', 'Standards']"
NewsApi.org,"Summary Evergrande sends $83.5 mln for last-minute payment - source

Chinese property company faces more imminent debt deadlines

Next 30-day payment grace period expires on Oct. 29

Global financial markets on tenterhooks

HONG KONG/SHANGHAI, Oct 22 (Reuters) - China Evergrande Group (3333.HK) appeared to have averted default with a last-minute bond coupon payment, a source said on Friday, buying it another week to wrestle with a debt crisis looming over the world's second-biggest economy.

The property developer also announced plans to give future priority to its electric vehicles business over real estate.

Facing a deadline on Saturday to pay interest on a U.S. dollar bond, Evergande sent $83.5 million to a Citibank trustee account on Thursday, the person with knowledge of the matter told Reuters.

That brought relief for investors and regulators worried about fallout for global markets and added to reassurances from Chinese officials that creditors would be protected. read more

Still, the world's most indebted property firm - with more than $300 billion in liabilities - needs to make payments on a string of other bonds, with the next major deadline to avoid default on Oct. 29.

With little known about its ability to pay and property sales tumbling 30% in the last 12 months, there is deep scepticism over Evergrande's capacity to ride out the crisis.

The company, once China's top-selling property developer, did not respond to a request for comment on debt payment.

Citibank declined to comment.

Evergrande chairman Hui Ka Yan said on Friday the company would aim to make its new electric vehicle venture its primary business instead of property within 10 years.

Property sales will slow to about 200 billion yuan ($31.31 billion) per year by that time, compared to more than 700 billion yuan last year, he was quoted as saying by the state-backed Securities Times.

Evergrande's new vehicle business, founded in 2019, has yet to reveal a production model or sell a single vehicle. Last month, the unit warned it was still seeking new investors and asset sales, and that without either it might struggle to pay salaries and cover other expenses.

'BIT OF A RELIEF'

Evergrande's overall woes have snowballed for months and its dwindling resources set against its vast liabilities have wiped out 80% of its value. read more

Founded in Guangzhou in 1996, the developer epitomised a freewheeling era of borrowing and building. But that business model has been scuttled by hundreds of new rules designed to curb developers' debt frenzy and promote affordable housing.

It was not clear how cash-strapped Evergrande was able to raise funds to pay the bondholders or whether any had already received the money. Evergrande next needs to find $47.5 million by Oct. 29 and has nearly $338 million in other offshore coupon payments coming up in November and December. read more

""While obviously a positive, the coupon payment does not address the overall concerns about Evergrande's sustained liquidity through the first maturity in Q2 2022 and beyond,"" said John Han, a partner at law firm Kobre & Kim in Hong Kong.

""This only shows that the company is not yet ready for the house to come down completely through a massive cascade of cross defaults. Time is needed for what is planned next."" read more

1/2 The company logo is seen on the headquarters of China Evergrande Group in Shenzhen, Guangdong province, China September 26, 2021. REUTERS/Aly Song Read More

If it fails to make next week's payment, or any other final deadlines in coming weeks, defaults would be triggered on all $19 billion of its bonds in international capital markets.

That would be the second biggest emerging market corporate default after Venezuela's state-owned oil firm.

Evergrande missed coupon payments totalling nearly $280 million on its dollar bonds on Sept. 23, Sept. 29 and Oct. 11, beginning 30-day grace periods for each. read more

DISTRESSED LEVELS

Evergrande's dollar bond prices surged on Friday morning after news of the transfer, with its April 2022 and 2023 notes jumping more than 10%, data from Duration Finance showed, though they still traded at deeply distressed levels of less than a quarter of face value.

Those gains evaporated on Friday afternoon in Asia, however, pushing several of the company's other bonds down more than 6%.

Evergrande's shares rose as much as 7.8% before closing up 4.3%, but still finished a shortened week down 8.8%.

Evergrande's woes have reverberated across the $5 trillion Chinese property sector, which accounts for a quarter of the economy by some metrics, with a string of default announcements, rating downgrades and slumping corporate bonds. read more

Chinese property companies could now be locked out of offshore debt markets until early next year. read more

Still, Friday's news helped the Hang Seng mainland properties index (.HSMPI) rise 3.3%.

In mainland markets, the CSI300 Real Estate index finished up 2.4%, and an index tracking the broader property sector (.CSI000006) added 2%.

Asked whether it would step in to help its rival ease its liquidity crisis, the chairman of China's third-biggest developer, China Vanke Co Ltd (000002.SZ), said developers needed to ensure their own safety first.

""Everyone feels the chill as 'winter' arrives for the sector,"" Chairman Yu Liang told a company forum.

Any prospect of Evergrande's demise raises questions over more than 1,300 real estate projects it has in some 280 cities.

Bank exposure to developers is also extensive.

A leaked 2020 document, branded a fake by Evergrande but taken seriously by analysts, showed the company's liabilities extended to more than 128 banks and over 121 non-banking institutions.

""Given that we have little clarity on how bank financing is going for stalled real estate projects, but we know that project pre-sales are down a lot, the onshore business is unlikely to be supplying cash to Evergrande near-term,"" said Quiddity's Lundy.

Reporting by Clare Jim, Scott Murdoch, Sumeet Chatterjee in Hong Kong, Samuel Shen and Andrew Galbraith in Shanghai, Anshuman Daga and Tom Westbrook in Singapore, and Marc Jones in London; Writing by Sam Holmes and Andrew Cawthorne; Editing by Christopher Cushing and David Clarke

Our Standards: The Thomson Reuters Trust Principles.",22/10/2021,Citibank,"The property developer also announced plans to give future priority to its electric vehicles business over real estate.
The company, once China's top-selling property developer, did not respond to a request for comment on debt payment.
Evergrande chairman Hui Ka Yan said on Friday the company would aim to make its new electric vehicle venture its primary business instead of property within 10 years.
Evergrande's new vehicle business, founded in 2019, has yet to reveal a production model or sell a single vehicle.
read moreChinese property companies could now be locked out of offshore debt markets until early next year.",China Evergrande sends funds to trustee for bond coupon due Sept 23 -source - Reuters,https://www.reuters.com/world/china/china-evergrande-sends-funds-trustee-bond-coupon-due-sept-23-source-2021-10-22/,TRUE,English,reuters.com,neutral,0,0.99,0.01,mixed,0.16,0.11,0.73,"['China Evergrande', 'Reuters', 'Evergrande', 'tenterhooks', 'Reuters', 'China Evergrande Group', 'Evergande', 'Citibank', 'Reuters', 'Evergrande', 'Citibank', 'Evergrande', 'Securities Times', 'Evergrande', 'Evergrande', 'Evergrande', 'Evergrande', 'Evergrande', 'Kobre & Kim', 'China Evergrande Group', 'REUTERS', 'Evergrande', 'Evergrande', 'Duration Finance', 'Evergrande', 'Evergrande', 'HSMPI']","['China Evergrande', 'bond coupon', 'funds', 'trustee', 'Reuters', 'second biggest emerging market corporate default', 'Hang Seng mainland properties index', 'Next 30-day payment grace period', 'U.S. dollar bond', 'CSI300 Real Estate index', '$5 trillion Chinese property sector', 'last-minute bond coupon payment', 'other offshore coupon payments', '30-day grace periods', 'dollar bond prices', 'broader property sector', 'Hui Ka Yan', 'state-backed Securities Times', 'state-owned oil firm', 'other final deadlines', 'international capital markets', 'Chinese property companies', 'electric vehicles business', 'offshore debt markets', 'imminent debt deadlines', 'indebted property firm', 'next major deadline', 'early next year', 'new electric vehicle', 'Global financial markets', 'Citibank trustee account', 'new vehicle business', 'top-selling property developer', 'Chinese property company', 'China Evergrande Group', 'mainland markets', 'corporate bonds', 'last-minute payment', 'biggest economy', 'global markets', 'debt payment', 'Chinese officials', 'dollar bonds', 'next week', 'single vehicle', 'law firm', 'property sales', 'other expenses', 'primary business', 'business model', 'new rules', 'default announcements', 'other bonds', 'debt frenzy', 'HONG KONG/SHANGHAI', 'future priority', 'deep scepticism', '200 billion yuan', '700 billion yuan', 'production model', 'new investors', 'asset sales', 'dwindling resources', 'freewheeling era', 'affordable housing', 'overall concerns', 'first maturity', 'John Han', 'massive cascade', 'Guangdong province', 'REUTERS/Aly Song', 'coming weeks', 'DISTRESSED LEVELS', 'Duration Finance', 'rating downgrades', 'debt crisis', 'last 12 months', 'overall woes', 'vast liabilities', 'cross defaults', 'company logo', 'a quarter', 'face value', 'Summary Evergrande', 'Evergrande chairman', 'Friday morning', 'Friday afternoon', 'Oct.', 'tenterhooks', 'world', 'plans', 'Saturday', 'interest', 'Evergande', 'Thursday', 'person', 'knowledge', 'matter', 'relief', 'regulators', 'fallout', 'reassurances', 'creditors', 'string', 'ability', 'capacity', 'request', 'comment', '10 years', 'unit', 'salaries', 'BIT', 'Guangzhou', 'borrowing', 'building', 'hundreds', 'funds', 'bondholders', 'money', 'November', 'December', 'liquidity', 'Q2', 'partner', 'Kobre', 'Kim', 'house', 'headquarters', 'Shenzhen', 'Venezuela', 'Sept.', 'news', 'transfer', 'April', '2023 notes', 'data', 'gains', 'Asia', 'shares', 'shortened', 'metrics', 'slumping', 'HSMPI', 'CSI00000', 'rival']"
NewsApi.org,"The company logo is seen on the headquarters of China Evergrande Group in Shenzhen, Guangdong province, China September 26, 2021. REUTERS/Aly Song

HONG KONG, Oct 25 (Reuters) - Some China Evergrande Group (3333.HK) bondholders have received coupon payments for a dollar bond tranche that was due Sept. 23 and for which the 30-day grace period ended last Saturday, two people with knowledge of the matter said on Monday.

Evergrande, the world's most indebted property firm with more than $300 billion in liabilities, had sent $83.5 million to a Citibank trustee account on Thursday, a person with knowledge of the matter told Reuters on Friday. read more

That fund has now been transferred to at least some of the offshore bondholders, said the people on Monday, declining to be identified as they were not authorised to speak to the media.

An Evergrande spokesperson said the company did not have a comment.

Reporting by Clare Jim and Andrew Galbraith; Editing by Christopher Cushing

Our Standards: The Thomson Reuters Trust Principles.",25/10/2021,Citibank,"The company logo is seen on the headquarters of China Evergrande Group in Shenzhen, Guangdong province, China September 26, 2021.
REUTERS/Aly SongHONG KONG, Oct 25 (Reuters) - Some China Evergrande Group (3333.HK) bondholders have received coupon payments for a dollar bond tranche that was due Sept. 23 and for which the 30-day grace period ended last Saturday, two people with knowledge of the matter said on Monday.
Evergrande, the world's most indebted property firm with more than $300 billion in liabilities, had sent $83.5 million to a Citibank trustee account on Thursday, a person with knowledge of the matter told Reuters on Friday.
An Evergrande spokesperson said the company did not have a comment.
Reporting by Clare Jim and Andrew Galbraith; Editing by Christopher CushingOur Standards: The Thomson Reuters Trust Principles.",Some Evergrande bondholders received coupon payment for Sept 23 tranche -sources - Reuters,https://www.reuters.com/business/some-evergrande-bondholders-received-coupon-payment-sept-23-tranche-sources-2021-10-25/,TRUE,English,reuters.com,negative,0.01,0.19,0.8,negative,0.06,0.36,0.58,"['Evergrande', 'Reuters', 'China Evergrande Group', 'REUTERS', 'Reuters', 'China Evergrande Group', 'Evergrande', 'Citibank', 'Reuters', 'Evergrande', 'Thomson Reuters']","['Some Evergrande bondholders', 'coupon payment', 'Sept 23 tranche', 'sources', 'Reuters', 'The Thomson Reuters Trust Principles', 'Some China Evergrande Group', 'dollar bond tranche', '30-day grace period', 'indebted property firm', 'Citibank trustee account', 'An Evergrande spokesperson', 'Guangdong province', 'REUTERS/Aly Song', 'HONG KONG', 'coupon payments', 'Clare Jim', 'Andrew Galbraith', 'Christopher Cushing', 'company logo', 'two people', 'offshore bondholders', 'headquarters', 'Shenzhen', 'knowledge', 'matter', 'Monday', 'world', 'liabilities', 'Thursday', 'Friday', 'fund', 'media', 'comment', 'Reporting', 'Editing', 'Standards']"
NewsApi.org,"A view of the exterior of the Citibank corporate headquarters in New York, New York, U.S. May 20, 2015. REUTERS/Mike Segar

Oct 28 (Reuters) - Citigroup Inc (C.N) said on Thursday it will require all U.S. employees to be vaccinated against COVID-19 as a condition of their employment.

The bank will comply with the Biden administration policy requiring all workers supporting government contracts to be fully vaccinated, as the government remains a ""large and important"" client of Citi, said Sarah Wechter, head of human resources, in a LinkedIn post.

However, the bank said it will assess exemptions on religious or medical grounds, or any other accommodation by state or local law, on a case-to-case basis.

Big Wall Street institutions have been grappling with questions around employee safety and how to bring back workers, as the highly infectious Delta variant of the coronavirus spread across the country. While some firms have pushed back their return-to-office plans, others have chosen to stay the course.

Earlier this month, Bank of America Corp (BAC.N) said it will pay out $200 awards to its employees at Merrill Lynch Wealth Management who are fully vaccinated and going to office regularly.

Reporting by Manya Saini in Bengaluru; Editing by Devika Syamnath

Our Standards: The Thomson Reuters Trust Principles.",28/10/2021,Citibank,"A view of the exterior of the Citibank corporate headquarters in New York, New York, U.S. May 20, 2015.
REUTERS/Mike SegarOct 28 (Reuters) - Citigroup Inc (C.N) said on Thursday it will require all U.S. employees to be vaccinated against COVID-19 as a condition of their employment.
While some firms have pushed back their return-to-office plans, others have chosen to stay the course.
Earlier this month, Bank of America Corp (BAC.N) said it will pay out $200 awards to its employees at Merrill Lynch Wealth Management who are fully vaccinated and going to office regularly.
Reporting by Manya Saini in Bengaluru; Editing by Devika SyamnathOur Standards: The Thomson Reuters Trust Principles.",Citigroup to require all U.S. employees to be vaccinated - Reuters,https://www.reuters.com/business/citigroup-require-all-us-employees-be-vaccinated-2021-10-28/,TRUE,English,reuters.com,neutral,0.01,0.97,0.02,mixed,0.28,0.23,0.49,"['Citigroup', 'Reuters', 'Citibank', 'REUTERS', 'Reuters', 'Citigroup Inc', 'C.N', 'Citi', 'LinkedIn', 'Big Wall Street', 'Bank of America Corp', 'BAC', 'Merrill Lynch Wealth Management', 'Thomson Reuters']","['U.S. employees', 'Citigroup', 'Reuters', 'The Thomson Reuters Trust Principles', 'Big Wall Street institutions', 'Merrill Lynch Wealth Management', 'Citibank corporate headquarters', 'Biden administration policy', 'infectious Delta variant', 'U.S. employees', 'New York', 'Mike Segar', 'Citigroup Inc', 'C.N', 'important"" client', 'Sarah Wechter', 'human resources', 'LinkedIn post', 'medical grounds', 'other accommodation', 'local law', 'employee safety', 'America Corp', 'Manya Saini', 'Devika Syamnath', 'government contracts', 'case basis', 'office plans', 'view', 'exterior', 'Thursday', 'COVID', 'condition', 'employment', 'workers', 'large', 'exemptions', 'religious', 'state', 'questions', 'coronavirus', 'country', 'firms', 'return', 'others', 'course', 'BAC.', '$200 awards', 'Reporting', 'Bengaluru', 'Editing', 'Standards']"
NewsApi.org,"STOCKHOLM (Reuters) - Sweden’s Handelsbanken, having cut staff and branches, expects lower personnel expenses in coming quarters but faces rising investment in on-line services, the bank’s CEO said on Wednesday.

FILE PHOTO: A branch of Handelsbanken is seen in Wilmslow, northern England, January 12, 2015. REUTERS/Phil Noble

It beat third-quarter profit forecasts after market close on Tuesday and announced it would make a strategic exit from Denmark and Finland. [L1N2RF1S1]

However, investors were unimpressed and analysts pointed to the lack of progress in cost cutting.

Underlying expenses, which worried investors in recent years, were up 3% in the first nine months of this year.

Handelsbanken shares were down 3.2% at 0949 GMT.

It said its target of reaching an annual cost base of 20 billion Swedish crowns had lost its relevance due to higher development costs and its exit from Denmark and Finland.

“We are putting more and more in cloud-based solutions, that changes the playing field a bit,” CEO Carina Akerstrom told Reuters in an interview on Wednesday.

She said its other cost-cutting measures were developing according to plan, noting the bank had decreased its number of branches and staff, and that the effect on personnel cost would filter through in coming quarters.

The bank did not provide a new cost target.

Citibank said in a note that underlying costs “continued to disappoint” and said that it saw no visible improvement in personnel costs.

Handelsbanken reported a third-quarter net profit of 5.19 billion Swedish crowns ($602 million), up from 3.32 billion a year earlier and beating the 4.65 billion expected by analysts, Refinitiv data showed.",20/10/2021,Citibank,"STOCKHOLM (Reuters) - Sweden’s Handelsbanken, having cut staff and branches, expects lower personnel expenses in coming quarters but faces rising investment in on-line services, the bank’s CEO said on Wednesday.
REUTERS/Phil NobleIt beat third-quarter profit forecasts after market close on Tuesday and announced it would make a strategic exit from Denmark and Finland.
It said its target of reaching an annual cost base of 20 billion Swedish crowns had lost its relevance due to higher development costs and its exit from Denmark and Finland.
Citibank said in a note that underlying costs “continued to disappoint” and said that it saw no visible improvement in personnel costs.
Handelsbanken reported a third-quarter net profit of 5.19 billion Swedish crowns ($602 million), up from 3.32 billion a year earlier and beating the 4.65 billion expected by analysts, Refinitiv data showed.",Handelsbanken CEO expects lower personnel costs - Reuters.com,https://www.reuters.com/article/handelsbanken-results-ceo-idUSKBN2HA0ZY,TRUE,English,reuters.com,neutral,0.01,0.97,0.02,negative,0,0,1,"['Reuters.com', 'Reuters', 'Handelsbanken', 'Handelsbanken', 'REUTERS', 'Handelsbanken', 'Reuters', 'Citibank', 'Handelsbanken', 'Refinitiv']","['lower personnel costs', 'Handelsbanken CEO', 'Reuters', 'third-quarter profit forecasts', 'first nine months', '20 billion Swedish crowns', 'other cost-cutting measures', 'third-quarter net profit', '5.19 billion Swedish crowns', 'annual cost base', 'higher development costs', 'CEO Carina Akerstrom', 'lower personnel expenses', 'new cost target', 'personnel cost', 'cost cutting', 'Underlying expenses', 'underlying costs', 'coming quarters', 'rising investment', 'line services', 'FILE PHOTO', 'northern England', 'Phil Noble', 'recent years', 'cloud-based solutions', 'playing field', 'visible improvement', 'Refinitiv data', 'strategic exit', 'Handelsbanken shares', 'STOCKHOLM', 'Reuters', 'Sweden', 'staff', 'branches', 'Wednesday', 'Wilmslow', 'market', 'Tuesday', 'Denmark', 'Finland', 'L1N2RF1S', 'investors', 'analysts', 'lack', 'progress', '0949 GMT', 'relevance', 'interview', 'plan', 'number', 'effect', 'Citibank', 'note']"
