API,Article,Date,Searchword,Summary,Title,URL,Verified,Language,Source,Title_Sentiment,Title_Positive,Title_Neutral,Title_Negative,Article_Sentiment,Article_Positive,Article_Neutral,Article_Negative,NER,Topics
NewsApi.org,"Citigroup C, -0.88% said Monday it'll incur ""significant"" charges for winding down its Citibank Korea Inc. unit, and that it'll likely provide more details in the next four business days. The bank said the move is part of its previously announced plans to exit its consumer franchises in 13 markets across Asia, Europe, the Middle East and Africa. The charges will be incurred through the end of 2023 and will include cash expenditures related to voluntary termination benefits and related charges. Citibank Korea Inc. has begun negotiation of the voluntary termination benefits and related charges with employee unions. Shares of Citi rose 0.3% in pre-market trades. The stock is up 15.8% so far this year, compared to a jump of 21% by the S&P 500.",25/10/2021,Citibank,"Citigroup C, -0.88% said Monday it'll incur ""significant"" charges for winding down its Citibank Korea Inc. unit, and that it'll likely provide more details in the next four business days.
The bank said the move is part of its previously announced plans to exit its consumer franchises in 13 markets across Asia, Europe, the Middle East and Africa.
The charges will be incurred through the end of 2023 and will include cash expenditures related to voluntary termination benefits and related charges.
Citibank Korea Inc. has begun negotiation of the voluntary termination benefits and related charges with employee unions.
The stock is up 15.8% so far this year, compared to a jump of 21% by the S&P 500.",Citigroup expects 'significant' charges from shuddering Korea consumer banking unit,https://www.marketwatch.com/story/citigroup-expects-significant-charges-from-shuddering-korea-consumer-banking-unit-2021-10-25,TRUE,English,marketwatch.com,neutral,0.07,0.89,0.04,neutral,0.02,0.83,0.15,"['Citigroup', 'Citigroup C', 'Citibank Korea Inc.', 'Citibank Korea Inc.', 'Citi']","['Korea consumer banking unit', ""significant' charges"", 'Citigroup', 'next four business days', 'Citibank Korea Inc. unit', 'voluntary termination benefits', 'Citigroup C', 'consumer franchises', 'Middle East', 'cash expenditures', 'employee unions', 'pre-market trades', 'S&P 500', 'significant"" charges', 'related charges', 'details', 'move', 'part', 'plans', '13 markets', 'Asia', 'Europe', 'Africa', 'negotiation', 'Shares', 'stock', 'jump', '2023', '21']"
NewsApi.org,"China Evergrande Group paid the US$83.5 million interest payment on its offshore bond, just before a 30-day grace period runs out for declaring it in default, as the world's most indebted developer took action to assure a capital market on edge about the spectre of the nation's highly leveraged property sector.

The Shenzhen-based developer wired the payment due on its 8.25 per cent, US$2.03 billion bond maturing in March 2022 to Citibank on Thursday, according to separate reports by the state-run China Securities Times newspaper and Reuters, both citing unidentified sources. Evergrande did not respond to a request for confirmation while Citibank, the bond's trustee, declined to comment.

Evergrande missed paying the coupon on September 23, and was given a 30-day grace period to comply before it was being declared in default, which could trigger cross defaults on much of its offshore debt and in the worst case set the stage for bondholders to petition for its liquidation. The developer negotiated an ""off-exchange resolution on a separate 4 billion yuan (US$618 million) senior note before a separate deadline last month.

Do you have questions about the biggest topics and trends from around the world? Get the answers with SCMP Knowledge, our new platform of curated content with explainers, FAQs, analyses and infographics brought to you by our award-winning team.

Evergrande, with more than US$300 billion in liabilities, is hardly out of the woods, as it missed five interest payments on its offshore debt in September and October, including Thursday's coupon payment. It has two coupon payments totalling US$235 million due on Sunday.

SCMP Graphics alt=SCMP Graphics

Its track record was better with onshore debt, as Evergrande made what it called its ""best effort"" to comply, paying the interest this week due on a 2.1 billion yuan senior note that matures in October 2025.

Evergrande, with numerous entities and publicly traded subsidiaries involved in everything from its core real estate development to electric cars, health, bottled water and even a football club, had doubled down on its negotiations to stave off a financial collapse.

Story continues

Its venture Jumbo Fortune Enterprise got creditors to agree this week to an extension on the repayment of a US$260 million bond that Evergrande had guaranteed, according to REDD Intelligence, a bond information portal.

Investors cheered the coupon payment, pushing Evergrande's shares up by as much as 7.8 per cent to an intraday high of HK$2.78 in Hong Kong, reversing yesterday's 12.5 per cent slump when the developer's plan to sell a unit for US$2.6 billion failed to materialise. Evergrande Property Services Group, the management unit that Evergrande withdrew from sale, rose by as much as 5.3 per cent, in contrast to the 10.2 per cent tumble when the withdrawal was announced.

Source: Northeast Securities, Tianfeng Securities, company reports. SCMP Graphics alt=Source: Northeast Securities, Tianfeng Securities, company reports. SCMP Graphics

Evergrande's deteriorating finances had spilled over to other leveraged developers in China's property industry, raising concerns among investors about the state of a sector that makes up an estimated 14 per cent of China's economy.

Several Chinese developers, including Hong Kong-listed Sinic Holdings Group and Fantasia Holdings Group, have defaulted on their debt this month, sparking a series of downgrades in the sector by major credit rating agencies.

On Wednesday, Modern Land (China) cancelled its plan to repay a portion of a high-yield US$250 million bond and extend it just days before it was set to mature.

Hui Ka-yan (centre) chairing an undated signing ceremony with his senior executives, where they pledged to deliver China Evergrande Group's housing projects to buyers on time, in a photograph published on 1 September 2021. Photo: Weibo. alt=Hui Ka-yan (centre) chairing an undated signing ceremony with his senior executives, where they pledged to deliver China Evergrande Group's housing projects to buyers on time, in a photograph published on 1 September 2021. Photo: Weibo.

Founded by Chinese tycoon Hui Ka-yan in 1996 in Guangzhou, Evergrande has been racing to sell off assets, from properties under development to a stake in a Northeast China-based bank, to ease its liquidity crunch and repay suppliers - many who say they have not been able to get paid for months.

However, it ran into issues recently as it tried to amass enough capital to keep the lights on and complete its backlog of 1.3 trillion yuan in unfinished properties.

The company has failed to attract a buyer for a 2.2 million sq ft plot in Yuen Long that it hoped to sell at a loss and state-backed Yuexiu Property dropped its proposed US$1.7 billion offer for Evergrande's 26-storey office tower in Wan Chai this month.

On Wednesday, Evergrande said it scrapped the sale of a controlling stake in its Hong Kong-listed property management business to China-based developer Hopson Development in a cantankerous back-and-forth between the two companies. However, Hopson left the doors open on Thursday, saying it still consider the purchase agreement legally binding.

Hui Ka-yan, also known as Xu Jiayin, during a press conference with Fabio Cannavaro, the new head coach of the Guangzhou Evergrande Football Club on November 9, 2017 in Guangzhou. Photo: Getty Images.) alt=Hui Ka-yan, also known as Xu Jiayin, during a press conference with Fabio Cannavaro, the new head coach of the Guangzhou Evergrande Football Club on November 9, 2017 in Guangzhou. Photo: Getty Images.)

Chinese authorities, including People's Bank of China Governor Yi Gang, have said that they can contain the economic and financial risks associated with the Evergrande crisis, but have not stepped forward with a public lifeline for the company because of its ""poor management"" and that it ""expanded blindly.""

The Evergrande crisis has left Chinese officials in a difficult spot as they try to balance policy efforts to control speculative pricing bubbles in the mainland property sector with the need to maintain social stability, particularly given the importance housing plays in its economy.

""We believe the mounting pressure will lead the authorities to take further measures to accelerate credit growth before the year-end, including reserve requirement ratio cuts,"" Fitch Ratings analysts Andrew Fennell and Grace Wu said in a research note on Thursday. ""They may also scale back the implementation of some property-related regulations.""

""The three red lines and other measures to control developer leverage may also be tempered, even while they retain rhetorical value as part of government campaigns to improve housing affordability and rein in financial risks,"" they added.

This article originally appeared in the South China Morning Post (SCMP), the most authoritative voice reporting on China and Asia for more than a century. For more SCMP stories, please explore the SCMP app or visit the SCMP's Facebook and Twitter pages. Copyright © 2021 South China Morning Post Publishers Ltd. All rights reserved.

Copyright (c) 2021. South China Morning Post Publishers Ltd. All rights reserved.",22/10/2021,Citibank,"Evergrande did not respond to a request for confirmation while Citibank, the bond's trustee, declined to comment.
The developer negotiated an ""off-exchange resolution on a separate 4 billion yuan (US$618 million) senior note before a separate deadline last month.
Evergrande Property Services Group, the management unit that Evergrande withdrew from sale, rose by as much as 5.3 per cent, in contrast to the 10.2 per cent tumble when the withdrawal was announced.
Hui Ka-yan, also known as Xu Jiayin, during a press conference with Fabio Cannavaro, the new head coach of the Guangzhou Evergrande Football Club on November 9, 2017 in Guangzhou.
alt=Hui Ka-yan, also known as Xu Jiayin, during a press conference with Fabio Cannavaro, the new head coach of the Guangzhou Evergrande Football Club on November 9, 2017 in Guangzhou.","Evergrande staves off default, paying US$83.5 million of overdue offshore bond coupon before 30-day grace period runs out",https://finance.yahoo.com/news/evergrande-dodges-default-paying-us-093000388.html,TRUE,English,finance.yahoo.com,neutral,0.18,0.53,0.29,mixed,0.05,0.17,0.78,"['Evergrande', 'China Evergrande Group', 'Citibank', 'China Securities Times', 'Reuters', 'Evergrande', 'Citibank', 'Evergrande', 'SCMP Knowledge', 'Evergrande', 'SCMP Graphics', 'SCMP Graphics', 'Evergrande', 'Evergrande', 'Jumbo Fortune Enterprise', 'Evergrande', 'REDD Intelligence', 'Evergrande', 'Evergrande Property Services Group', 'Evergrande', 'Northeast Securities', 'Tianfeng Securities', 'Northeast Securities', 'Tianfeng Securities', 'Evergrande', 'Sinic Holdings Group', 'Fantasia Holdings Group', 'Modern Land', 'China Evergrande Group', 'Weibo', 'China Evergrande Group', 'Weibo', 'Evergrande', 'Yuexiu Property', 'Evergrande', 'Evergrande', 'Hopson Development']","['overdue offshore bond coupon', '30-day grace period', 'Evergrande', 'default', 'state-run China Securities Times newspaper', 'Hong Kong-listed Sinic Holdings Group', 'major credit rating agencies', '2.2 million sq ft plot', 'core real estate development', 'high-yield US$250 million bond', 'US$83.5 million interest payment', 'Evergrande Property Services Group', '2.1 billion yuan senior note', 'Fantasia Holdings Group', 'US$260 million bond', 'US$1.7 billion offer', 'US$2.03 billion bond', '30-day grace period', 'Jumbo Fortune Enterprise', 'undated signing ceremony', '26-storey office tower', 'state-backed Yuexiu Property', 'five interest payments', 'bond information portal', 'separate 4 billion yuan', 'Several Chinese developers', 'property management business', 'other leveraged developers', 'Northeast China-based bank', 'The Shenzhen-based developer', 'two coupon payments', 'China Evergrande Group', '12.5 per cent slump', '1.3 trillion yuan', 'Northeast Securities', 'property industry', 'offshore bond', 'Tianfeng Securities', 'senior executives', 'Chinese tycoon', 'two companies', 'separate reports', 'separate deadline', '8.25 per cent', '7.8 per cent', '5.3 per cent', '10.2 per cent', '14 per cent', 'China-based developer', 'property sector', 'capital market', 'unidentified sources', 'cross defaults', 'worst case', 'exchange resolution', 'biggest topics', 'SCMP Knowledge', 'new platform', 'award-winning team', 'SCMP Graphics', 'track record', 'numerous entities', 'electric cars', 'football club', 'financial collapse', 'REDD Intelligence', 'intraday high', 'management unit', 'deteriorating finances', 'Modern Land', 'Hui Ka-yan', 'housing projects', 'liquidity crunch', 'enough capital', 'Yuen Long', 'Wan Chai', 'Hopson Development', 'indebted developer', 'offshore debt', 'onshore debt', 'company reports', 'unfinished properties', 'controlling stake', 'world', 'action', 'spectre', 'nation', 'March', 'Citibank', 'Thursday', 'Reuters', 'request', 'confirmation', 'trustee', 'September', 'stage', 'bondholders', 'liquidation', 'questions', 'trends', 'answers', 'content', 'explainers', 'FAQs', 'analyses', 'infographics', 'liabilities', 'woods', 'October', 'Sunday', 'subsidiaries', 'everything', 'health', 'water', 'negotiations', 'Story', 'venture', 'creditors', 'extension', 'repayment', 'Investors', 'shares', 'plan', 'sale', 'contrast', 'withdrawal', 'concerns', 'economy', 'series', 'downgrades', 'Wednesday', 'portion', 'centre', 'buyers', 'photograph', 'Weibo', 'Guangzhou', 'assets', 'suppliers', 'months', 'issues', 'lights', 'backlog', 'loss']"
NewsApi.org,"JIM LO SCALZO / EPA-EFE

In a last-minute move just moments before the Senate was set to vote on the debt ceiling, Senate Minority Leader Mitch McConnell said Republicans would extend a debt limit extension until December.

Read: Yellen: Congress Has Two Weeks to Fix Debt Ceiling or US Will Go Into a Recession

Senior Stimulus: How an Additional $1,400 Check Could Help Social Security Recipients Afford Rising Grocery Costs

“To protect the American people from a near-term Democrat-created crisis, we will also allow Democrats to use normal procedures to pass an emergency debt limit extension at a fixed dollar amount to cover current spending levels into December,” he said in a statement posted on Twitter:

My new statement on the Democrats’ self-created debt limit crisis: pic.twitter.com/XwuqyS9oZ0 — Leader McConnell (@LeaderMcConnell) October 6, 2021

“This will moot Democrats’ excuses about the time crunch they created and give the unified Democratic government more than enough time to pass standalone debt limit legislation through reconciliation. Alternatively, if Democrats abandon their efforts to ram through another historically reckless taxing and spending spree that will hurt families and help China, a more traditional bipartisan governing conversation could be possible,” he continued in the statement.

More: Department of Education Announces Overhaul of Public Service Loan Forgiveness Program

Senator Patty Murray said that Democrats plan to delay today’s procedural vote on the debt limit — originally slated at 3pm ET — to discuss internally the Senate Minority Leader Mitch McConnell proposal, CNN reports.

Earlier in the day, Senate Majority Chuck Schumer tweeted, “Democrats are working to bring this GOP-manufactured default crisis to a swift end and avoid irreparable economic harm to people and families. Today, the Senate will vote on moving forward on House-passed legislation to suspend the debt ceiling.”

Story continues

Democrats are working to bring this GOP-manufactured default crisis to a swift end and avoid irreparable economic harm to people and families. Today, the Senate will vote on moving forward on House-passed legislation to suspend the debt ceiling. — Chuck Schumer (@SenSchumer) October 6, 2021

Meanwhile, President Biden met with CEOs and leaders today to discuss the need to raise the debt ceiling, including leaders of the American Association of Retired Persons (AARP), Bank of America, Citibank, Deloitte, Intel, JP Morgan, Nasdaq, the National Association of Realtors, and Raytheon, according to a statement on the White House’s website.

“The failure to raise the debt limit will undermine the safety of the United States Treasury securities; threaten the reserve status of the dollar as the world currency and the — that the world relies on; downgrade America’s credit rating; and result in a rise in interest rates for families — talking about mortgages, auto loans, credit cards,” Biden said today, according to the transcript of this speech.

Government Shutdown 2021: Will Social Security Checks Still Be Sent?

Recessions Explained: Definition, Warning Signs and What Happens During One

“My friends — and they are — many are my friends — the Senate Republicans’ position I find to be not only hypocritical, but dangerous and a bit disgraceful, especially as we’re crawling our way out of a pandemic that cost America 700,000 lives thus far, and we’re still battling it. Our markets are rattled. America’s savings are on the line. The American people — your savings, your pocketbook — are directly impacted by this stunt. It doesn’t have to be this way,” he added.

More From GOBankingRates5 Things Most Americans Don't Know About Social Security

The Secrets Behind These 10 Popular Costco Products

Social Security Benefits Might Get Cut Early -- What Does It Mean for You?

When Social Security Runs Out: What the Program Will Look Like in 2035



Last updated: October 6, 2021

This article originally appeared on GOBankingRates.com: McConnell To Allow Short-Term Debt Limit Extension To Pass — Democrats Delay Vote To Mull Proposal",06/10/2021,Citibank,"JIM LO SCALZO / EPA-EFEIn a last-minute move just moments before the Senate was set to vote on the debt ceiling, Senate Minority Leader Mitch McConnell said Republicans would extend a debt limit extension until December.
More: Department of Education Announces Overhaul of Public Service Loan Forgiveness ProgramSenator Patty Murray said that Democrats plan to delay today’s procedural vote on the debt limit — originally slated at 3pm ET — to discuss internally the Senate Minority Leader Mitch McConnell proposal, CNN reports.
Today, the Senate will vote on moving forward on House-passed legislation to suspend the debt ceiling.
Government Shutdown 2021: Will Social Security Checks Still Be Sent?
When Social Security Runs Out: What the Program Will Look Like in 2035Last updated: October 6, 2021This article originally appeared on GOBankingRates.com: McConnell To Allow Short-Term Debt Limit Extension To Pass — Democrats Delay Vote To Mull Proposal",McConnell To Allow Short-Term Debt Limit Extension To Pass — Democrats Delay Vote To Mull Proposal,https://finance.yahoo.com/news/mcconnell-allow-short-term-debt-204900569.html,TRUE,English,finance.yahoo.com,negative,0,0.17,0.83,mixed,0.1,0.15,0.75,"['EPA-', 'EFE', 'Senate', 'Senate', 'Congress', 'Twitter', 'Department of Education', 'Senate', 'CNN', 'GOP', 'Senate', 'House', 'GOP', 'Senate', 'House', 'American Association of Retired Persons', 'AARP', 'Bank of America', 'Citibank', 'Deloitte', 'Intel', 'JP Morgan', 'Nasdaq', 'National Association of Realtors', 'Raytheon', 'White House', 'States', 'Treasury', 'Senate', 'GOBankingRates5', 'Costco']","['Short-Term Debt Limit Extension', 'McConnell', 'Democrats', 'Vote', 'Proposal', 'Social Security Recipients Afford Rising Grocery Costs', 'Public Service Loan Forgiveness Program', 'Senate Minority Leader Mitch McConnell proposal', 'Democrats’ self-created debt limit crisis', 'traditional bipartisan governing conversation', 'United States Treasury securities', 'emergency debt limit extension', 'Short-Term Debt Limit Extension', 'standalone debt limit legislation', 'Senate Majority Chuck Schumer', 'Social Security Checks', 'Social Security Benefits', 'term Democrat-created crisis', 'GOP-manufactured default crisis', 'JIM LO SCALZO', 'Senator Patty Murray', 'irreparable economic harm', '10 Popular Costco Products', 'current spending levels', 'unified Democratic government', 'fixed dollar amount', 'Senate Republicans’ position', 'Leader McConnell', 'The American people', 'debt ceiling', 'House-passed legislation', 'spending spree', 'Government Shutdown', 'American Association', 'last-minute move', 'Two Weeks', 'Senior Stimulus', 'Additional $1,400 Check', 'normal procedures', 'time crunch', 'enough time', 'reckless taxing', 'CNN reports', 'swift end', 'Retired Persons', 'JP Morgan', 'National Association', 'White House', 'reserve status', 'credit rating', 'interest rates', 'auto loans', 'credit cards', 'Warning Signs', 'GOBankingRates5 Things', 'Most Americans', 'GOBankingRates.com', 'Democrats’ excuses', 'procedural vote', 'President Biden', 'world currency', 'new statement', 'EPA-EFE', 'December', 'Yellen', 'Congress', 'Recession', 'near', 'Twitter', 'XwuqyS9oZ0', 'LeaderMcConnell', 'reconciliation', 'efforts', 'families', 'China', 'Department', 'Education', 'Overhaul', '3pm', 'day', 'Story', 'SenSchumer', 'CEOs', 'leaders', 'need', 'AARP', 'Citibank', 'Deloitte', 'Intel', 'Nasdaq', 'Realtors', 'Raytheon', 'website', 'failure', 'safety', 'rise', 'mortgages', 'transcript', 'speech', 'Definition', 'friends', 'way', 'pandemic', '700,000 lives', 'markets', 'savings', 'line', 'pocketbook', 'stunt', 'Secrets', 'October', 'article']"
